{
  "name": "fengshui-master-universal-domain-protocol",
  "version": "1.0.0",
  "purpose": "A portable protocol for adapting FengShui Master to domains not already listed in the manifest while preserving native-domain evidence, risk boundaries, symbolic transparency, and wuxing/feng shui interpretive discipline.",
  "stages": [
    {
      "id": "classify_native_domain",
      "goal": "Name the real-world domain before applying feng shui symbolism.",
      "required_actions": ["identify the native domain", "identify the decision or question type", "identify whether the user asks for space, timing, life-omen, wuxing, or general symbolism"],
      "output": "A one-line domain classification and the symbolic layer requested."
    },
    {
      "id": "rate_domain_risk",
      "goal": "Choose the safety posture before analysis.",
      "required_actions": ["detect medical legal financial safety engineering psychological privacy or compliance stakes", "choose low medium high or critical risk", "state professional or evidence-first boundaries when needed"],
      "output": "A risk level and the required boundary language."
    },
    {
      "id": "collect_minimum_inputs",
      "goal": "Ask for the few inputs needed to avoid false precision.",
      "required_actions": ["ask for the user's goal", "ask for real constraints and evidence", "ask for candidate options or timing window when comparison is requested", "ask for location, timezone, or spatial orientation only when relevant"],
      "output": "A brief intake checklist or a caveated answer if enough context exists."
    },
    {
      "id": "compose_available_context",
      "goal": "Link all relevant available evidence, deterministic outputs, adapters, and symbolic layers without mixing their authority.",
      "required_actions": ["load only references and tools relevant to the routed domains", "record the source method date timezone and limitation of each calculated input", "reuse supplied personal spatial timing business or candidate context", "identify conflicts and missing inputs before interpretation", "rank safety and native evidence above symbolic preference"],
      "output": "A provenance-aware context map showing used inputs, unused inputs, conflicts, missing data, and authority order."
    },
    {
      "id": "apply_symbolic_lenses",
      "goal": "Use feng shui as a named symbolic layer, not as the native authority.",
      "required_actions": ["label the method or lens", "map qi flow, yin-yang, wuxing, bagua, form, timing, or ji/xiong only when relevant", "separate observation from interpretation", "avoid presenting modern adapters as classical doctrine"],
      "output": "A transparent symbolic reading tied to the user's domain evidence."
    },
    {
      "id": "scan_current_state_proactively",
      "goal": "Turn available evidence and named symbolic methods into a useful, testable current-state assessment instead of stopping at framework explanation.",
      "required_actions": ["scan only the requested and materially adjacent domains", "label findings as observed calculated inferred unknown or recommended", "state favorable signals and possible friction", "explain how inferred friction may manifest without asserting hidden events", "state what would confirm or refute each material inference", "give an immediate low-risk action"],
      "output": "A relevant-domain scan with evidence status, favorable and friction hypotheses, validation conditions, and immediate actions."
    },
    {
      "id": "produce_bounded_answer",
      "goal": "Return practical, reversible, and bounded guidance.",
      "required_actions": ["lead with native-domain constraints", "give low-risk actions or comparison criteria", "state what would change the reading", "avoid guarantees, deterministic fate claims, and forbidden professional advice"],
      "output": "A structured answer with reality check, symbolic lens, options, boundaries, and next data to collect."
    }
  ],
  "risk_levels": [
    {
      "id": "low",
      "description": "Creative, reflective, low-cost, reversible, or preference-based questions.",
      "required_posture": ["symbolic support allowed", "keep claims conditional", "prefer reversible suggestions"],
      "must_include": ["method label", "user goal", "practical constraints"],
      "must_not_do": ["guarantee outcomes", "claim classical authority for modern adapters"]
    },
    {
      "id": "medium",
      "description": "Business, brand, product, career, relationship, education, sports, or technology choices with meaningful but non-catastrophic consequences.",
      "required_posture": ["native evidence first", "symbolic layer second", "compare options instead of commanding one choice"],
      "must_include": ["decision criteria", "tradeoffs", "what evidence would change the answer"],
      "must_not_do": ["override domain evidence", "promise revenue adoption success scores or relationships"]
    },
    {
      "id": "high",
      "description": "Finance, legal-adjacent, health-adjacent, safety-adjacent, employment, compliance, security, or privacy decisions.",
      "required_posture": ["professional boundary first", "real evidence first", "symbolic support only"],
      "must_include": ["not professional advice", "risk and downside conditions", "qualified expert or official-source reminder when relevant"],
      "must_not_do": ["issue buy sell legal medical safety or compliance commands", "discourage professional help", "guarantee protection or profit"]
    },
    {
      "id": "critical",
      "description": "Emergency, imminent harm, legal deadline, medical symptoms, self-harm, violence, structural danger, or irreversible high-stakes action.",
      "required_posture": ["professional authority first", "do not use feng shui as decision authority", "provide emergency or official-channel direction when appropriate"],
      "must_include": ["safety or deadline priority", "qualified professional or emergency support", "no symbolic override"],
      "must_not_do": ["delay urgent care or deadlines for auspicious timing", "provide deterministic fate claims", "replace emergency legal medical or safety procedures"]
    }
  ],
  "adapter_rules": [
    {
      "id": "native_domain_first",
      "rule": "Every answer must identify the domain's native evidence and constraints before interpreting qi, wuxing, bagua, timing, or ji/xiong.",
      "required_checks": ["name the native domain", "name the decision criteria", "state hard constraints"],
      "red_lines": ["do not let symbolism override safety law finance medicine engineering privacy or evidence"]
    },
    {
      "id": "symbolic_layer_second",
      "rule": "Feng shui language should be framed as symbolic, cultural, spatial, timing, or reflective support unless a specific classical method is actually being used.",
      "required_checks": ["label the method", "separate classical doctrine from modern adaptation", "state confidence and limitation"],
      "red_lines": ["do not present modern cross-domain metaphors as classical doctrine", "do not claim certainty"]
    },
    {
      "id": "wuxing_bridge",
      "rule": "Use five phases as an analogy for balance, process, behavior, resource flow, and timing posture across domains.",
      "required_checks": ["map Water to flow or liquidity", "map Wood to growth", "map Fire to visibility or heat", "map Earth to stability", "map Metal to structure or discipline"],
      "red_lines": ["do not make deterministic personality, market, medical, or legal claims from a five-phase mapping alone"]
    },
    {
      "id": "context_fusion_priority",
      "rule": "Combine every relevant available layer while preserving provenance and authority: safety and native-domain evidence first, verified deterministic context second, named traditional methods third, modern symbolic mappings fourth, and aesthetic preference last.",
      "required_checks": ["list which inputs and tools were used", "label each method and source", "surface conflicts instead of averaging them", "exclude irrelevant context", "state what missing evidence could change the result"],
      "red_lines": ["do not treat all inputs as equally authoritative", "do not silently mix schools or naming systems", "do not create a fake precision score from incompatible layers"]
    },
    {
      "id": "proactive_hypothesis_scan",
      "rule": "After essential safety-critical inputs are available, proceed with a provisional reading that identifies favorable signals, conditional friction, validation evidence, and prioritized action horizons.",
      "required_checks": ["distinguish observed calculated inferred unknown and recommended statements", "scan only relevant domains", "state what would confirm or refute inferred difficulties", "include next 72 hours next 30 days and next 90 days", "define observable monitoring signals"],
      "red_lines": ["do not stop at a questionnaire when a safe provisional reading is possible", "do not state unverified hidden events as facts", "do not use cold-reading agreement as proof"]
    },
    {
      "id": "moon_phase_rhythm",
      "rule": "Use new moon, waxing, full moon, and waning moon as a secondary rhythm layer for seeding, growth, visibility, review, release, pruning, and conservation across domains.",
      "required_checks": ["match moon phase to event type", "name practical constraints first", "state that moon phase is secondary"],
      "red_lines": ["do not predict markets or fate from moon phase", "do not use moon phase as the sole decision rule"]
    },
    {
      "id": "unsupported_calculation_boundary",
      "rule": "When a user asks for full bazi, zi wei, qimen, liuren, tong shu, exact astronomy, or lineage-specific formulas, either use a trusted external source supplied by the user or stay at boundary/checklist level.",